{"accepted_source_encodings":["UTF-8","UTF-8-SIG"],"artifact_kind":"DERIVATION_PROFILE","canonicalization_profile":"veritrail-json-c14n/1","fact_kinds":["MODULE","CLASS_DECLARATION","FUNCTION_DECLARATION","METHOD_DECLARATION","IMPORT_DECLARATION"],"language":"PYTHON","language_semantics":"PYTHON_3_10","normalization_rules":{"anchor":"raw-blob-half-open/1","fact_projection":"r1-python-facts/0.1","identifier":"python-3.10-nfkc/1","import_projection":"r1-python-import-literal/0.1","path":"git-path-hex/1"},"profile_digest":"e8bbe54140ff2a082b69d6b6967d8630a423abd135ac6e7be0badc1fe053125b","profile_id":"veritrail-python-source-3.10","profile_version":"0.1","relation_kinds":["LEXICAL_CONTAINS","IMPORT_TARGET_LITERAL"],"schema_version":"0.1","supported_entry_kinds":["REGULAR_BLOB","EXECUTABLE_BLOB"],"traversal_rules":{"algorithm":"breadth-first/1","budget":"inclusive-atomic-edge/1","cycle_identity":"fact-and-relation-digest/1","tie_break":"r1-relation-rank/0.1"}}
